{
  "schema": "acef.model-routing-policy.v1",
  "policyId": "model-choice-2026-10-27",
  "note": "Binds every actor admitted through ACEF routing (Full capsule-supervisor roles and Fix/Standard dispatches under admitted-role-routing-v1); here the policy wins over method/MODEL_CHOICE.md. Free choices (ordinary Claude Code subagents, Codex runs and tours that ACEF routing does not admit) follow method/MODEL_CHOICE.md. Mechanical, light and browser-tour work has no role here.",
  "activeProvider": "openai",
  "roles": {
    "conductor": {
      "executionClass": "orchestration",
      "reasoningTier": "medium",
      "sessionPolicy": "single-resumable-per-epic",
      "evidence": "compiled capsule-supervisor actions; semantic acceptance remains delegated"
    },
    "atdd": {
      "executionClass": "semantic-critical",
      "reasoningTier": "high",
      "sessionPolicy": "fresh-per-story",
      "evidence": "unmeasured semantic role; retain conservative floor"
    },
    "development": {
      "executionClass": "semantic-critical",
      "reasoningTier": "high",
      "sessionPolicy": "single-resumable-per-story",
      "evidence": "unmeasured semantic role; retain conservative floor"
    },
    "code-review": {
      "executionClass": "semantic-standard",
      "reasoningTier": "medium",
      "sessionPolicy": "fresh-per-reviewed-tree",
      "evidence": "V327-CAL-001 blind Judge: medium 30/30, high 28/30, both found held-out HIGH; measured on gpt-5.6-sol, carried to gpt-6.1-sol without recalibration"
    },
    "patch-assurance": {
      "executionClass": "semantic-critical",
      "reasoningTier": "high",
      "sessionPolicy": "fresh-per-reviewed-tree",
      "evidence": "unmeasured semantic role; retain conservative floor"
    },
    "process-judge": {
      "executionClass": "semantic-critical",
      "reasoningTier": "high",
      "sessionPolicy": "fresh-conditional",
      "evidence": "independent escalation role; retain conservative floor"
    },
    "epic-process-judge": {
      "executionClass": "semantic-critical",
      "reasoningTier": "high",
      "sessionPolicy": "fresh-isolated",
      "evidence": "independent terminal role; retain conservative floor"
    }
  },
  "providers": {
    "openai": {
      "models": {
        "orchestration": "gpt-6.1-sol",
        "semantic-standard": "gpt-6.1-sol",
        "semantic-critical": "gpt-6.1-sol"
      },
      "reasoning": {
        "low": "low",
        "medium": "medium",
        "high": "high",
        "xhigh": "xhigh",
        "max": "max"
      },
      "note": "Codex keeps one model (sol) and varies reasoning effort by role; gpt-6.1-terra is for browser tours only and has no role here (method/MODEL_CHOICE.md). The 6.1 remap is not recalibrated."
    },
    "anthropic": {
      "models": {
        "orchestration": "claude-sonnet-5-5",
        "semantic-standard": "claude-sonnet-5-5",
        "semantic-critical": "claude-opus-5-5"
      },
      "reasoning": {
        "low": "low",
        "medium": "medium",
        "high": "high",
        "xhigh": "high",
        "max": "max"
      },
      "note": "Matches method/MODEL_CHOICE.md (2026-10-27): critical work on Opus, standard and orchestration on Sonnet. A host that keeps critical development on Sonnet because an Opus review follows records that as a host override of providers.anthropic.models.semantic-critical. Effort is a recorded claim; the launcher must open the session at that effort. Select with active-run --routing-provider anthropic or a repo override activeProvider."
    }
  }
}
